They teach Dr Racket in this course. No one ever uses Dr Racket. This is waste of time but can't skip it either.,Hardest Class in 1A! Study until your hand hurts from those proofs. Also post midterm is much easier than pre-midterm.,Pretty cool course. They teach you a bunch of number theory and a lot of it is very interesting.,Interesting course was generally fun to learn its contents. Assignments were more difficult than midterm though...,tough course. hardest course for my first term,"im lucky i passed this course, i would never want to this ever again....",Note: The curriculum has changed since I took this course.,You gotta get used to proofs if you're a math student.,"Not a bird course online imo, instructors barely interact, and almost no practice material is given (outside of a textbook with bad quizzes).",,"Get the course notes and read through them if you're having any difficulty with any topics. Could probably just learn the whole course from the course notes, but lectures are still useful for examples and different methods. Lots of new stuff from high school, proofs scared the living daylights out of most before we got used to them, but it became easier with a bit of practice. Just a matter of getting used to the creative way of thinking. Very interesting course if you want to understand some number theory",
"Joke course if you're a CS major who is taking it just to get a good CAV (to transfer from regular to co-op, that is).",Get the study guide. You'll thank me later.,"This course is feared by many first year students and I can see why. For the people that do fail, it is mostly a case of them not adapting to university level math aka no more easy plug and chug. This is a beautiful course if you can appreciate math and logic. That being said, I did not find this course easy. Assignments take very long if you are trying to get perfect on them. That being said, I do recommend trying to get perfect on them, though sometimes it is wise to let one question go. To succeed in this course, I'd recommend reading the course notes which were super useful in understanding the basic material. Do your assignments and do well on them. Clear up all your confusions in tutorials or office hours and definitely use Piazza. A lot of students I find avoid Piazza, but in my term W2015, the profs on Piazza were amazing and almost always online. They were extremely helpful with assignments without giving answers away as long as you showed to them you were making progress and trying to solve the problem. With all this being said, I ended up doing rather poorly in this course (high 70s) for the amount of effort I put in due to doing poorly on the final. You definitely need a clear head for the exams since they involve proofs, something I lacked that day.","Very challenging course with a lot of content - requires a lot of work, but it's definitely useful and interesting for future courses.",This course kills a part of me. It is quite possibly the driest course I have taken at Waterloo so far. The hardest part of this course is trying to muster the motivation to learn about the stupidest concepts ever.,"Before midterm is every easy, but things go tough after the midterm",Sedra Smith recommended me this course so I don't end up like one of those pig 4 students. I did very well and am happy about my life choices.,A real math course. You will learn how to actually think mathematically since you probably don't know yet. An excellent course for the very foundation of math.,"Avoid the online course but, it has a nice bell curve",,"One of the more interesting math courses, difficult at first but really improves and tests logical thinking ability. Make sure to do every assignment question and fully understand the solutions to do well",
fuck i hate design recipe. your lose marks for nothing!,"you gotta at least pay attention in class, or do homework",Fascinating course that ramped up in difficulty after midterms.,Interesting yet challenging course.,One of my favorite classes of undergrad. It's very reasonable as long as you start the assignments early on your own and don't copy off of others,Really easy. I had no previous coding experience and I picked it up the concepts super quickly. You have to go to class though. Slides are NOT enough,"I like proofs. But not because of this course, but because of Math239 which is a descendant of this course. You will learn LOTS of great techniques for proofs, you may hate it or love it. I would say this usually depends on the professor. I got Shane Bauman, not sure if I liked his style, but for sure he was very energetic. Shane is a great teacher, but his pace is very fast for many. I would personally NOT recommend him since he doesn't post notes online for students to catch up. Go with profs who (may go fast with their lectures but) post their notes online.","The first part is useful, it shows me some justifications on what is different from what I learned in high school (something like 0^0=1). The second part is annoying, since I didn't learn number theory in high school, so it's hard for me to cope with difficult questions. When it goes to Prime Number, there are questions I have no idea to get full marks (question itself is easy to answer, but no idea how to avoid losing partial marks, fortunately, TAs are willing to give full marks) The third part RSA (application on number theory) is really interesting. Overall, easy course with a high grade because there are 2 free bonus marks. The final exam is hard. Some questions you have no idea how to get full marks even if you know how to solve them. If you have done many proofs in high school, easy 90+ as an online course. Just using Excel to make a calculator. EEA helps a lot.","Took this course online by Prof Wendy Roth, easy course, but felt 102 is easier than 101.",,"Was a nice way to learn recursion, which is essentially the purpose of this course. They also give a lot of free marks with a 3% lab bonus - DO THEM! That 3% can make a big difference in your mark.",
,"Not very useful as an elective, but I suppose it gives a better understanding of how markets work. It was very easy - I just had to read lecture slides. The midterms and final exam are all multiple choice.","Not an ""EASY"" course at all. Anyone commentating that is probably a Math/Eng student who is already familiar with coding through other courses. Since the midterm/exam is on paper, you have to be able to imagine what your code is going to be able to do without actually testing it like you do in your assignments! Speaking of assignment, they're bloody hard! No joke, it might take you an entire day to problem solve your way through them and that might not even be enough - incredibly frustrating course and not recommended unless you really want to study coding in the future. DR. Racket is not even applicable to most organizations. If you want to learn coding, just pick up something off Amazon or get a pdf through a friend - don't spend money here unless you're actually planning on continuing studies in CS.","Definitely a challenging course, especially if you have no prior experience with writing formal proofs. Just make sure that you practice the concepts by finding question banks online and you'll be fine!","The end of the course became quite tough but otherwise this was pretty manageable. Excellent professors and ISA's who always take our feedback and concerns into consideration to make the course experience better, including having office hours very late at night and very early in the morning. The online platform is also excellent and fun to use.",Learn nothing but gain a super high mark. Good course for those who want to switch programs or apply coop. Everything is common sense so nothing needs to memory.,"The course notes textbook make this class a breeze. Make sure you fully understand theorems, lemmas, etc if you want to do well.",the basic of math,"Can be difficult at times, but a very rewarding and fun course. Definitely made me like CS as a non-CS student! Start assignments early and definitely go to office hours. TAs and ISAs are very helpful.",,"I really enjoyed this class! It was quite difficult, but I learned a lot!",
,"Very easy course and the material was interesting enough. Dry at some points but it's just memorization for those bits. You don't need to go to lectures, you can just read the textbook and do study guide questions. Was an easy 95+.",Very useful course. Anton is a great prof who actually cares about his students. It does get hard towards the end of the course but there is always help available when you need it.,"Not easy, but what I will say is that I loved just about every concept we covered. It was truly interesting, challenging (but not challenging to the point where I felt I couldn't do it). Really just one of my favourite courses I've ever taken.","Pretty good online, First half is deceptively easy, second half gets much more difficult, especially exam. Pretty good introduction to proofs",I passed with a 75 and still don't know anything about economics,"Easy pass, just go to class.",Proofs are a pretty big shift from high school math,"Olivia Mesta was a great professor, made the material extremely clear and easy to understand. Weekly quizzes on Aplia were time consuming but helped you understand the material better. Multiple choice exams were very easy.",,"Don’t be mistaken, this course is tough. It will teach you pretty much the foundations of UW mathematics. You need to listen and spend a lot of time just thinking about the problems. Take some time with the course and you’ll enjoy it a lot.",
,"With Prof Corey (Cornelis Van De Waal), I didn't have to look in the textbook or use the workbook. I studied straight from his slides. The only case which I would have used the books is if I were aiming for a perfect 100% in the course (which is doable), but I wasn't.","This is a very well-organized course, which is great, since it is likely your first introduction to proofs, which will be absolutely central to any future math courses you take. Take note that the math in this course is very different from high school math and will probably require you to shift your thinking about mathematics from one of computation to one of puzzle-solving. Make sure to start the weekly assignments early since they can be a little unpredictable in how long they take. Also, every lecture day there is a 24-window to complete a Mobius quiz, which cumulatively count for 10% of your grade, so remember to do them (they can be easy to forget).","Pretty difficult course, but very useful for future years.",easy and light first year course,Please be very careful about the design recipe (especially tests and examples),"Highly recommend doing the readings, and assigned questions and trying to understand the course material in addition to just the prepared lecture slides. A lot of memorizing and understanding of graphs. In the end all of the content builds on itself so make sure to understand what you are learning as you are learning it. The best prep is being able to draw the graphs, and also to do the multiple choice questions in the handbook.","Could've just been the lecturer (Allison Mascella) I had, and found it hard to understand topics (since she didn't offer much clarification). You can understand topics in the real world context and therefor found it useful",it wasn't that hard but the prof made it complicated.,,"Fairly easy course overall, enjoyed the class a lot. Carrie Knoll was an excellent lecturer.",
,Wasted my elective on this when I could have taken much better courses.,"Easy course if you study, Hard course if you're too lazy to put in the time.",It is a useful course but definitely not easy if you never prove before.,Fun and useful course!,Two words: WOKIA KUMASE,"Not bad, do the modules, I didn't need the textbook","A transition course from high school math to university math. Quite a lot of important proof techniques were taught and you have to really understand the concepts and apply them other than just simply memorizing them. Proof questions in the assignments are usually much more challenging than those in the midterm/exam so don't get discouraged if you cannot solve them. Do more practices and seek help and you will be fine. Be sure that you can solve all the computational problems in the exam as they are ""easy"" marks!","I really enjoyed this course online, being co-taught by 4 professors. There were lots of office hours available to help and all of the TA's and Profs in office hours were helpful and kind. While the programming language used is not useful elsewhere, I think it is easy to understand and helped get the point of the course across. In my opinion, the point of this course is to teach you to think about solving problems and the process to go through, as you are not creating ground-breaking programs. As a student with no prior programming experience, I found this course both useful and easy if you kept up with the content and got help as soon as you needed it. The course was organized well, and the built in questions made sure you were on the right track. The assignments are fair based on what you learn. Go in with an open mind and keep up with the content and you should be just fine.",,Its not entirely easy but you learn really a lot from this course and most concepts are very fascinating. Personally I struggle more with complex numbers than number theory.,
,Interesting and easy. Make sure to do exercises after class. I dont think it is necessary to read the textbook unless you feel like to do so.,"Classes teach you nothing. Getting and reading the textbook is a must! I sat for three hours trying to keep up with the graphs being drawn and didn't have any time to comprehend what was being said. Nafeez doesn't allow photos to be taken of her notes so you couldn't even take a picture to give you time to listen. Unless you have some sort of economic background, you will be struggling through teaching yourself this course.","Learning how to do proofs...well, this course wasn't very interesting especially if you are not of the math type. Assignments are difficult. Midterm was easy and final was easy-fair though.",loved this course,,"It is an useful course but make sure you choose the right prof. Do not take with Wokia because you can't understand anything. Micro is more mathy of a course so if you are good at logic or maths, this course would be easier than macro for you. But for non mathy students, this course would be challenging. The final was difficult too.",A lot of Math that you probably didn't see in high school.,"Weekly assignments are not worth much, but are difficult. Weekly labs. 1 midterm, 1 final. Doing the labs will greatly help with the assignments. Asking questions to TAs and prof will help a lot.",,Probably my favourite course in 1A. Easy to do well in the course and the staff put the learning materials together really well. Really enjoyed this course since it teaches you about the art of problem-solving and the creative components of mathematics. If you stay on top of the material and start the psets early enough you'll do well.,
,"Very boring class, most people seemed to be playing Hearthstone. I would not recommend, unless this course is a requirement for you.",You can get by without much studying. Don't take it online if you have the choice,hard but study then not hard but might still be hard,"Entry-level cs course, no complicated stuff,easy assignments and midterms.",,no need to go to class,"A large variety of mathematical theorems, but most importantly proofs.","Racket sucks, but the content of the course was easy enough to digest if you never did programming before. Seek help if you need it (early) and don't be afraid to talk to the TAs and profs!",,"As someone who did a lot of math contests in high school, I found the course very exciting, and provided me with a new perspective and appreciation for language and proofs in mathematics.",
,"Read the text book, do those multiple choice questions from the study guide then you will be all set.","Weekly assignments are killer, but just be sure to get help if you fall behind. The course is not something to take lightly - the concepts are far different from the ""algebra"" you learn in high school. Proofs, proofs, proofs! -- This takes practice and time; so be sure to set aside time to work on these outside of your normal schedule - you're going to need it!",Good course. Exams are much easier than the assignments. It feels very rewarding when you figure out proofs.,Great introduction to math@UW! LOVED this course.,,Very dry and boring. All MC questions. Everything from the textbook. They try to trick you in some questions.,"If you do poorly in this course, you're probably not cut out for ""real"" math.",useless but easy to get a good grade,,"Learned a lot on how to properly write proofs and different mathematical ways of thinking. If you were even a bit serious about contest maths in high school, this course is an easy 90+. Also, Anton is just absolutely goated -- if you have the chance, join in on one of his lectures or even just read his lecture notes!",
,"As a science student with no background knowledge of business/economics, its not too easy. Yes the concepts are easy but if you dont read the textbook and actually put in effort you wont do better than high 70s.","It you get stuck on an assignment, take a break and revisit later. Don't let assignments become a time-sink.","Very interesting course, but requires dedication. Attending tutorials and doing ALL exercises is a good idea.","When I was taking this class, I had a casual conversation with my professor during which he told me that, though it starts off slow, it is actually possibly the hardest class in the maths faculty. And so I went ahead and braced myself for what was to come. To this day, I have no idea what he was talking about, and his seemingly sincere words continue to baffle me. This class was an easy ninety, and quite enjoyable as well. All the little proofs they give out are so satisfying to solve -- the same tranquil pleasure of sudoku or a crossword. I'm half tempted to publish a little booklet of them. I think I'm going to miss this class a little.",,This course is important to understand as it sets you up for the future with Linear Algebra.,Was really interesting to learn about RSA encryption and modular arithmetic in general.,You don't get the results of your quizzes which is sooo stupid. How should we understand where we went wrong if you don't tell us? I hated the quizzes but the discussions were easy marks if you post enough.,,Course basically taught itself,
,"Took it as a bird course. Sure, it was birdy, but it was really boring.","Easy bird course for any student looking to fill an elective. Course goes over a lot of concepts in a super broad manner, interesting for anyone looking to learn a little bit about economics concepts/terminology. Passed by studying all the lecture notes a few days before the midterms/final. All multiple choice!","Assignments are difficult, tests are easy, extremely useful",First course that teaches you what UW math is all about. You'll probably hate it.,,This course tests your logic,Almost all proofs in this course. Also covered RSA encryption which was kind of cool,"The online version course is very well structured. You get some check your understanding questions after each topic which is very useful and helpful. There is 10 weekly quizzes and 10 weekly written assignments in this course. This course starts very easy but gradually becomes more difficult, especially after the midterm. However, it is a very interesting course!",,"If there's one class you don't want to fall behind in, it's this one. Each new concept builds onto the previous one. If you're like me and don't have much experience with number theory or really any math outside of high school math courses (which you did well in), this will not be an easy course. A lot of the math is new and abstract. Make sure to do as much practice as you can to familiarize with all the theorems (there are a LOT of theorems). The final exam is worth 60% so even if you do well on the weekly assignments and midterm, you still have to study hard.",
,Use the study guide! Very helpful.,"I know a lot of people say this is a bird course, but I would say this: don't take a course just because it's birdy. Take something you are interested in, or you will end up doing so bad that you need to drop the course. At least that is what happened to me for this one.","Great course, I really enjoyed it. Not easy persay, but definitely not time consuming or difficult to understand.","All multiple choice, all about memory and understanding. One of the easiest courses in first year",,Make sure you get a good prof and it won't be too bad.,"Easy course, understand all the proof and theories and you will get high mark in this course easily",Trust the test bank and you will get mid 80 while just spending less than an hour a week,,"Pretty easy proofs course coming from a non-proof heavy background. Just do the weekly assignments and understand them (i.e. don't just get the answers from someone else, do them yourself), and lots of practice outside of that.",
,Do not take with PM (literally forgot prof's name cuz I never went to class). You will see why.,"Third time taking this course. Third time's the charm. Fun, though it's the bane of my existence.",Was a good course. Very interesting and stuff.,Super fun and well run course. Great intro to proofs.,,make sure you do the study guide questions and go to review sessions and you will get a lot of practice questions from upper years,This course is totally a easy course in university.,"Every week, your mind will be blown due to how insane some of the proofs become.",,"One of my favourite courses. Learning to do proofs is very useful directly in later courses, but also is a good way to think about things past proofs in courses",
,"Easy class, gg",NOT A BIRD COURSE! DON'T TAKE THIS SHIT!,"Various concepts were interesting, but unless you are prepared to work for it, it's not very easy.","Pretty simple stuff, watch Khan Academy and you'll be way better off. Very prof. dependent IMO, if you get a shitty one, you gotta teach yourself",,You don't even have to come to lectures.,I have no idea about my prof. That's it.,go to office hours and practice,,"This course does not test one's ability to study. This course tests once's ability to think. As such, to do well in the course, you'd better just be a naturally smart person, or else you are going to have to slog away at practice problems for dayss",
,Pay Attention and dont slack,Teaches you the essence of mathematics.,"The material is quite different from any math I have seen before, but it is generally straightforward. Some of the assignment questions were hard.",Hardest course I've taken. Barely passed.,,The assignments usually need time to be thought.,Easiest CS course this university has to offer. Basic math and you're good to go.,last 10 points,,"Do the assignments and practice problems and you should be good on the course! The course notes are really useful so read them regularly. Lectures aren't the most useful, but they do give tips on how to use formulas and theorems.",
,Super easy elective. Honestly kind of a joke of a class.,"The education quality is significantly impaired with no doubt since we are doing it online. Reviews before COVID was mostly positive. But after COVID-19, a lot of them are negative. I think that reflects something. Assignment were thrown into your face like you just have one class for the whole term. For me, I believe the material we learn and the assignment we need to do is inconsistent in terms of difficulty level. The gap between them is just huge. It often took me eight to twelve hours to finish the assignment. Don't take this if you are doing online.","Personally I thought the course was really easy-- at first. But don't let yourself slack off, because otherwise you will find yourself easily confused and lost as you fall further behind. Material gets harder as course moves along. Course material is still very relevant in other courses and in the future.",it's great to have a course teaching you how to prove,,"they dont go into specifics with the maths which ironically makes it harder for me because it involves more memorization of results as opposed to memorization of concepts. might be good or bad for you instead, who knows",Welcome to Waterloo Math.,,,"Do the assignments, practice, and you'll be fine.",
