Since I had prior programming experience this course seemed kind of useless. The language is good for teaching though.,Very interesting and useful course. Pay attention to the lectures as some of the content will show up in upper year math courses.,"Was fun at first as it's similar to competitive math, but as the term goes on and assignments pile, it's not that great. Assignments are based somewhat on the material but it will take a long time just to finish one question.","I found the course hard since it's not like anything we learned in high school. There were a lot of proofs and algorithms, which I'm not good at. However, the course is very interesting and I enjoyed it.",Hardest course I've taken yet. Manageable with ample studying and practicing though.,Course is super easy,People who like computer science will like this course.,"Hard course, but fundamental math concepts taught.","PROS: (1) Readings itself were simple to understand. (2) Nicely arranged content on Learn and Mobius (I took it online). (3) Decent grade, task, and submission period distribution. CONS: (1) Too many readings for a first-time learner of econ. (2) One collective zoom office hour (1 hour long) at the beginning of the week felt very unfair (3) Found a need for more OHs each week and a MS teams GC. (4) Felt isolated from the rest of the class. (5) lack of one-to-one instructional support (unless you email every question). (6) Had to refer to external resources for quicker understanding because readings were too time consuming. (7) Weren't taught at all on how to approach an article/case study. TIPS: (1) Finish all readings in the first two days of the week, (2) repeat quizzes till you get them correct (you get 4 chances per graded quiz every week, please use these well). (3) Don’t just read to study, answer a lot of MCQs.","Difficult course coming out of high school. The computational stuff wasn't bad (just involved practice) but, as others have said, proofs were the tough. I think the whole idea is to transition your mind from just computational/plug and play mathematics (the only kind you get exposed to in high school) to more creative thinking based mathematics.",In my opinion one of the best run courses. Does a great job of introducing a new perspective on math.,
"Not a bird course, although if you have background in programming it would not be difficult at all. Racket is somewhat useless but I learned some concepts that will be useful for other programming languages","Taken Online: I took this course because at one point I wanted to be a business student, this course taught me that it wasn't really for me in the end. Great bird course, really only skimmed notes before quizzes and crammed before finals and midterms. I wish I paid more attention so I could take 102 for the 3 prerequisite chain.",One of my favorite courses of all time. It's a breather from other courses since it really tests your logic and problem-solving skills. Each question feels like a fun puzzle.,The most difficult course in my 1A. Really suffered.,"A great course, but a little strange if you're used to object oriented programming.","Took it as a CSE, highest graded CSE course I have on record. Multiple choice midterm and final exams. Skipped couple lectures, but studying only the optional assignments and practice exams guaranteed a 100%","As someone who was nervous about proofs going into the course, I found that this course introduced them well! While I struggled with some of the concepts, I found proving things to be fun and sometimes even satisfying.","Omg, one bitch of a course. But it got interesting later on. It shows you how to formalize your proofs and give you a better understanding of proof techniques used later on.","Before midterms, super soft. After the first week of midterms, complete hell. Go to office hours for written assignments. Mobius assignments are free marks","Still get the chills from Econ 101, worst mark in my academic career.","This course teaches a completely new concept for most, proofs. Once you understand how to build a proof, the course gets easier, however some students never figure that part out. I think the pacing of the course is really well. My biggest piece of advice is to do the assignments by yourself. Struggling through and failing is how you learn. This is what will allow you to figure out exactly what theorems and techniques to use when which is the key to doing well overall. I personally really enjoyed proofs by the end of the course as it is a refreshing way to look at mathematics and if you truly love math you will love this course. That being said, the course is very professor dependent, so different professors provide very different experiences in this course.",
"I have never coded before so i opted to take this rather than CS135. This was really easy for me. I'm glad I took it though becuase it saved time so I can focus more on actual courses for my major (MATH145, PHYS121 etc). Don't expect to be able to code anything after this, especial since you use dr Raket. And the design recipes are a pain, my tip is put 20 test cases for everything.","Just read the textbook and slides, actual lectures seems to be pretty useless","I've never experienced a more terribly structured course than this one. You're basically left to teach yourself everything because the lectures are so incredibly boring, there's no way you're actually learning anything if you attend. Your time is much better spent not going, and just cramming at the end of the term & before the midterms of course. However, you're really just better off taking something that will actually teach you something useful. Don't take this as an elective if it's not required for your degree. If you're in math you'll have friends in this course, and you'll feel the urge to take it with them, but don't! You will thank yourself. It's such a waste of time and effort.","This course is all about writing proofs. Most of the concepts were super interesting but writing the proofs was challenging. The course is designed really well as each chapter flows into the next, so you really understand the connections. Do the assignments yourself and try to do the extra practice before midterms and finals. I personally loved this course!",First half of the course was on proof techniques. The material covered was for the most part easy albeit a bit bland. Midterm was fairly straightforward as was the final exam.,"Basic econ stuff. If you took econ in high school, it'll be pretty easy. Otherwise you might have some trouble, but it's still decently basic stuff, and concepts that can be explained by YouTube videos. The majority of the midterm and final questions (all MC) are from test banks if you can get those. Entire mark composed of two midterms and a final.","Took it online in W21 during COVID, concepts were taught in an abstract mathematical manner, which was fine (as a math major) however the concepts themselves just couldn't engage me enough to engage with the course. I'm sure if you put in minimum effort like most students you'll pass the course.","Very fun class with interesting, albeit not very applicable material. Covers stuff like elementary number theory and touches briefly on fields. Gives an intro to writing proofs by reading proofs, very well taught course. Only regret is not taking the advanced.","Didn’t take any econ courses in high school. This course was really easy, no need to read the textbook, the course notes are enough. You get 12 weekly quizzes, 2 group discussions, 1 midterm and the final. The first weekly quiz is ungraded and then the marks of 10 best quizzes out of 11 are considered which amounts to 40% of your grade. We also have 2 group discussions worth 10% each which are very easy. You can easily get a 9/10 in the discussions. The midterm contained 50mcq and the final consisted of 50mcqs and 5 short answer questions. Prof kumase did some review sessions on webex occasionally. These are recorded and can help you understand the concepts more clearly. It’s definitely a bird course. Spent only about a maximum of 4-5 hours per week. Ended up with a 93.",Boring but easy.,"The course was relatively easy, but the midterm was setup poorly - the focus was not on core concepts but on the exactness of the stepping problems, which I don't think is useful at all.",
great intro course for students with no background experience in CS and who don't plan on pursuing CS in the future. It can be prof dependent though.,"Take the time to combine notes from lectures and the textbook. Overall concepts were simple, but often a bit boring to read about.","I did not enjoy the course at all as I found the course to be so incredibly dull. Personally this honestly had to be one of the hardest courses, but I guess it really is prof dependent, as the final exams this term weren't even the same and didn't even cover the same material.",Quite an interesting course.,Pretty easy course overall! I stopped going to labs about three weeks in and still managed to get the bonus 3%. The assignments were relatively easy (with one or two exceptions).,"No assignments no quiz, just two midterms and a final for my section. Boring but quite easy.","I recommend finding a course with a language that is actually useful. Racket is dumb and never used anywhere. The majority of the course was quite easy, except a couple of concept checks that were RIDICULOUSLY HARD. i wish i had realized sooner that you get 10% of concept checks dropped from your grade. if you understand everything and are getting most things easily but you get stumped on one particular concept check, its probably not your fault and you should skip it, at least for now. the course was very well structured and predictable. expectations were clear and reasonable. it actually was designed to be a correspondence course, so it wasnt an online course that was rushed and slapped together for covid.","Very insightful course. Great if you love number theory. Has more applications in pure math than in other areas, but useful nonetheless for proofs.","Took this course online. Your mark essentially consists of a series of 10 question multiple choice quizzes weekly, 2 discussions, and 2 fully multiple-choice exams. Definitely was not a ""hard"" course, but I definitely do not think this course was as easy as many made it seem. You will need to put in at least a fair bit of effort, time, and devotion into this course in order to ensure a good mark.","I have never thought of or seen math like this before in high school. Being introduced to this course has definitely expanded my horizons on how I see mathematics being applied in the world. It is a challenging course and some concepts are hard to wrap your mind around, however, with practice, it is a doable course. The structure is great and the course is well maintained by the faculty.",Very interesting course. Demands a lot but teaches a lot as well,
"Even though Scheme was a very weird language, it was still an easy course overall, read the modules and you will do well.","useless course, took it as an elective and i needed to work hard, not a bird course for me, never took business inn highschool and also didnt bother to buy the textbook, which couldve helped. lectures everyone were on their phones or playing games on their laptops.","Amazing and challenging course overall. It's totally worth the hassle to override into this course even if you're not in the math faculty. The assignments are brutal to complete as they require so much time to figure out. But I would advise everyone to do them all on their own as they're there for you to develop the thinking you need to succeed. Anyone can understand a solution, but coming up with it is the hard part. It may be very difficult to do this in-between 5 other courses (3 of which are even tougher than Math 135), but it is possible. Good time management skills can lead to you finding more time to work on assignments such as the 10 minutes in-between lectures. The solutions will often feel like it comes down to a lucky guess. In general, the professors are pretty amazing. The math faculty doesn't send random people with thick accents to teach all their first year courses. Even if you do fail, there's still 10 more sections in the winter term where they mark easier, and 2 more sections in the spring where exams get easier. This course makes you a way better thinker when it comes to solving problems, and you'll gain way more out of it than most courses. This course can be an amazing experience to anybody.",Really interesting course. I was lost in class but it was much better when I self studied. NOT AS HARD as people say it is.,"fun stuff, felt really amazing grasping the content by the end. do the assignments on your own, go to all the lectures, and do the randomized practice. you should be fine.","It starts with a very low pace but after midterm, it gets really fast and I cannot understand the content while reaching the end of term. Racket is restricted by so many things so I feel I lose the freedom of coding. The assignments are extremely hard after midterm, I spent a whole day on them but I can just solve the easiest one. The only positive impression that I have is that the design recipe weighs half so I pass this course successfully.","It is important to go to the lectures, because that is the determinant factor of your grade and how good you will understand the course content.","By far the most interesting course of 1A. Teaching proof techniques is the main focus of the course, and is done quite well -- but all the topics that we touched on (gcd, complex numbers, modular arithmetic), were interesting too! One assignment a week, which usually took 3-6 hours, plus three Mobius quizzes a week, open for 24 hours each. The midterm was challenging but still fair, and the final was much easier. My only regret is not taking MATH 145 instead. If you are anywhere near the Euclid score cutoff, you should apply for the advanced courses instead -- you will likely find 135 to be fairly easy.","where do I even start, horrible prof, horrible class, made no effort to teach, everything was taught through reading the textbook, the class was made up of weekly quizzes, a midterm, and exam, which were all BS. The only reason I did good was that I took Econ in high school lol.","A difficult course coming from high school. The proof techniques are definitely useful to know if you're heading into Pure Math or something, but less relevant to a CS major. Nice to know, still. Makes me feel smarter.","Course was easy until immediately after the midterm, where it suddenly ramped up in difficulty (RSA in particular threw me for a loop). Assignments were much harder than any of the exams, so don't be discouraged if you can't do them. People hype this course up - it's challenging, but not impossible to do well in.",
"Majority of the material is only for math students. As a CS student, I was incredibly bored most of the term.",i had conrad hewitt. i didn't learn anything in class because he went so fast. honestly the notes for this course are really well made. i just went to the tutorial centre at mkv to finish off all the assignments with a LOT of help. pulled a decent mark somehow tho,"Interesting course because problem-solving is interesting. However, sometimes it gets boring (i.e. prime number stuff, modular artihmetic) because you know that you'll never apply this knowledge in real life (at least for me personally). Assignments are really annoying because sometimes they allow for basic hand-waving and other times they arbitrarily demand absolute rigour. As a result, you have to constantly browse Piazza to see what you can hand-wave and what you can't.","BE WARNED! This course is VERY challenging for those who are starting to do proofs. A lot of things get thrown at you very quickly, and it is hard to keep track of everything. Assignments took VERY long each week. Definitely NOT an easy course.","Probably the hardest first year course, a course solely on how to prove things. It is invaluable if you are pursuing a cs degree however.",Pretty sure you have to be retarded to fail this course. Casual course to boost GPA. Literally you can jerk off do w.e the f*** you want in class. Just review slides b4 midterm/exam and your gucci.,"Don't really like this course, but love the prof YIchun Huang! If you have her, just go for it! Hint: she uses test banks","Took this in person F2020, it truly opened my eyes to the world of real mathematics. Well-organized course with quite a few amazing prof. I had Faisal, really enjoyed his lectures and he was active on Piazza as well. The first half of the class teaches you proof techniques and some basic mathematical logic (which you will see again in CS 245), then second half goes into elementary number theory stuff (prime numbers, division theorem, modulo) and complex numbers. The weekly assignments were tough and I always do them 2 or 3 days before deadline so it was not a nice experience at all so my tip is to start them asap and get help from instructor or TA whenever you get dead stuck. I regret not going to office hours and had to suffer hard.","Jokes class. Took it with a prof who does nothing from the textbook and I swear he made up the whole course. Midterms and final are an easy 90, if not 110",,This course requires a complete shift in the mathematical thinking that you have done in high school so expect to spend a bit of time to get it right and understand how to solve the questions. Otherwise memorize all the theorems and definitions and you will be fine.,
The programming language (Scheme/Dr.Racket) wasn't a very good program to use but the concepts behind it are the same I guess ...,hard as hell... get a tutor and pay attention in class. do the assignments on your own as much as possible,"I can see the course being useful for other students, however I don't see the application to my daily life personally. I disliked this course strongly, due to my struggle with math and economic concepts, and was unfortunately required to take this course. Would not have taken it otherwise.",Very useful course,"When I say easy, take it in moderation. To many people, this will be the hardest 1A course you have.","Can't really speak to its usefulness, but it is a tough course for most people. It's very different from what we've been learning so far so make sure you attend lectures and do the assignments. Do not procrastinate on the assignments as you will regret this when midterms or finals come around. Practice using the theorems and practice the different proofs. Midterm and final are quite reasonable if you put in the work during the term. Final has a couple computation questions which are your easy marks so make sure you get those!",Make sure you memorize all of the propositions and theorems!,A course on proofs. It surveys topics in number theory to provide examples of theorems and their proofs. The content on things like modular arithmetic and complex numbers is less useful than the practice students get writing proofs.,No help or explanations in online course just give quiz let answers,,"Really good course, make sure you do a lot of practice. But watch out, you're professor can dramatically impact your experience in this course.",
"Really good course, the base of cs245.","As a math students, much of my time was wasted in this course. We had lectures on basic knowledge such as how to calculate the slope of a line and how to read a graph. A waste of my time. Should have taken my transfer credit from AP.",UGH :( the horrors of this course will haunt me for the rest of my university life,"Very interesting course, material can be challenging but that is part of why I liked it.","Arguably the hardest course in 1A for any first year in the faculty of mathematics. You really have to put the work in to understand the concepts which are not exactly easy to grasp. Assignments take many hours, midterm was fairly easy and final was fair. Good luck to anyone taking this course, just remember not to panic, you will be fine, everyone goes through the same stage and eventually we all survive.","Really easy and useful to know, all exams are multiple choice :) very useful for understanding political platforms and world issues (also just useful if you want to do anything in business)",Easy course (if you get the right prof).,"The course forces you to really understand proof techniques, and how exactly to prove things. This idea of proving things becomes very important in the future, so it is appropriate for students to take Math 135 as an early course. Proof-type questions can either take forever because you don't know how to approach the problem or have logically consistent arguments, or they can be done very quickly if you see what exactly you need to do and you are confident with your answer. Personally, I liked the proofs portion of the course more than the computation concepts later on since the elegance and conciseness of proofs are more appealing than repetitive computations. Overall, the course does a great job of getting you into the feel of University; it could make or break you quite easily.","Similar to the review before me, I took the online version. There are zero synchronous lectures, so be prepared to spend circa 3-5 hours every week trying to memorize the course content which is presented on UW Mobius. Another peculiarity of this course is the lack of any useful practice problems. The concept checks on UW Mobius are very elementary, and they are not a representation of what you will be evaluated on during the midterm and final exam. Although this course features weekly quizzes, you only have access to your grade after completing them. As a result, you will not be able to re-visit the weekly quizzes before the assessments to learn from your mistakes.",,Assignments were generally easy. Do the practice problems throughout the term and go to res tutoring or the tutorial centre if you need help with a question. You need a 60% in the course to pass.,
"It's pretty much an introduction to computer science concepts like recursion,BSTs and other abstract data types. It's VERY useful if you have no prior experience with programming.",Introductory course to microeconomics. Not hard at all if you read the textbook and make notes. I only spent two days studying before the midterm and the final and ended up with 80+.,"Got a 60 by taking a shit on the tests, by far the most useless course in my undergrad. The ONLY things that I use are the proof techniques. All the theorems are complete garbage.",I wouldn't say it was an easy course but it is definitely manageable. Midterm was not easy but finals was quite light. Definitely the course I enjoyed the most as I learned a lot.,"Fun, but the topics get too abstract nearing the end. The first half of the course was much more enjoyable and useful imo","The averages for the midterms were in the low 70s (harder to get a higher mark because there were only 27 scantron Q's every midterm). Concepts were easy to understand - application is the harder part. Aplia isn't useful, but she did post another link to practice questions before the exam and that really helped me. You'd be OK just studying from the powerpoints. Textbook is only if you want a better grasp of concepts.","The only way to do bad in this course is by not managing ur time properly. This is a mistake I made when we had to work with modules. As long as u properly manage ur time and do assignments and concept checks well before the due date, you will have a great time in this course. Also try finding connections between assignments and try finding some real world applications of racket. Trust me Racket is very useful. The only criticism I have of this course is how the course is taught because it wasn't taught. (this is when I did online.) I had to understand all concepts by myself by basically reading texts. Although There was plenty of opportunity like office hours to ask for help, I only realized that towards the end of the term. Very unfortunate :(",Basic math knowledge.,"Took online but in person classes. My prof, Koeller, was extremely helpful, definitely the best prof I've experienced thus far. The content is relatively interesting, but the weekly written assignments were made extremely difficult and were significantly harder than the content taught in class, almost to the point of absurdity. Aside from that though this is about as interesting as math can get.",,"This course was personally very easy for me and I enjoyed it very much. You learn the foundation of theory, proofs, elementary number theory and crypto. Really try to learn from this course; the assignments are tough and the exam was half the difficulty of the assignments (which is good).",
